{"schemaVersion":1,"eventId":"evt-20260907-v10-mystic-pickle-measuring","type":"candidate.status_changed","recordedAt":"2026-09-07T23:51:28Z","actor":"codex","data":{"experimentId":"exp-pinterest-static-format-v10","candidateId":"cand-v10-mystic-pickle-oracle","from":"published","to":"measuring","rationale":"The exact approved Mystic Pickle Arm A Pin is public and production-readback-verified. It is the second and final Pin today, the only Pin in this run, and the eleventh qualifying Pin under the 12-Pin bounded format authorization. Begin public-only 24-hour, seven-day, and 28-day measurement; Sandbox and Pinterest v3 remain excluded."}}
