{"schemaVersion":1,"eventId":"evt-20260903-v10-middle-management-briefed","type":"candidate.status_changed","recordedAt":"2026-09-03T16:35:20-07:00","actor":"codex","data":{"experimentId":"exp-pinterest-static-format-v10","candidateId":"cand-v10-middle-management-statue","from":"idea","to":"briefed","rationale":"The current listing, canonical destination, literal source-bound product identity, scale, front-only uncertainty, three distinct concepts, two selected executions, clean-control constraint, click hypotheses, fidelity risks, swap tests, and anti-template mechanisms are explicit."}}
