{
  "schemaVersion": 1,
  "eventId": "evt-20261025-pm-v11-metrics-1107815208389087383",
  "type": "metrics.recorded",
  "recordedAt": "2026-10-25T23:34:46Z",
  "actor": "codex",
  "data": {
    "experimentId": "exp-pinterest-editorial-mix-v11",
    "candidateId": "cand-v11-desktop-therapist-field-note",
    "checkpointAt": "2026-10-25T23:32:34.852Z",
    "cohort": "public",
    "source": "Scheduled measurement-only production Pinterest API lifetime snapshot; docs/ops/pinterest-measurements/2026-10-25-pm/measurement-20261025T233234852Z.json",
    "metrics": {
      "impressions": 24,
      "saves": 0,
      "pinClicks": 0,
      "outboundClicks": 0,
      "siteSessions": null,
      "affiliateClicks": null,
      "revenueCents": null
    },
    "caveats": [
      "Actual lifetime observation, not reconstructed exact-age history. Archived creative lifecycles retain their original public cohort membership.",
      "Explicit GA4 property507421709/PostHog project550427 bounded QA/operator-excluded aggregates; missing or unattributable per-Pin downstream remains unknown, not zero.",
      "Approved Goose Pin links and receipts are unchanged. Independently authorized path/query-preserving redirect verified2026-10-24T04:50:14.849Z is a destination/rebrand intervention, not format/acquisition proof; no routing change or new destination QA this run."
    ]
  }
}
