{
  "schemaVersion": 1,
  "eventId": "evt-20261024-am-v11-metrics-1107815208388765155",
  "type": "metrics.recorded",
  "recordedAt": "2026-10-24T16:38:41Z",
  "actor": "codex",
  "data": {
    "experimentId": "exp-pinterest-editorial-mix-v11",
    "candidateId": "cand-v11-farting-ring-field-note",
    "checkpointAt": "2026-10-24T16:33:54.943Z",
    "cohort": "public",
    "source": "Scheduled measurement-only production Pinterest API lifetime snapshot; docs/ops/pinterest-measurements/2026-10-24-am/measurement-20261024T163354943Z.json",
    "metrics": {
      "impressions": 27,
      "saves": 0,
      "pinClicks": 2,
      "outboundClicks": 0,
      "siteSessions": null,
      "affiliateClicks": null,
      "revenueCents": null
    },
    "caveats": [
      "Actual lifetime observation, not invented equal-age history; archived creative lifecycles retain public cohort membership.",
      "GA4 property 507421709 and PostHog project 550427 bounded QA/operator-excluded reads; per-Pin downstream remains unknown, not zero.",
      "Approved Goose Pin URLs remain unchanged; Cloudflare path/query-preserving redirects verified 2026-10-24T04:50:14.849Z now send them to Stupid. Separate pre/post-destination and rebrand effects from format; redirect QA is not acquisition."
    ]
  }
}
