{"schemaVersion":1,"eventId":"evt-20260905-v10-shark-mug-coastal-attempt","type":"prompt.recorded","recordedAt":"2026-09-05T23:37:20Z","actor":"codex","data":{"experimentId":"exp-pinterest-static-format-v10","candidateId":"cand-v10-shark-mug-coastal-breakfast","attemptId":"attempt-v10-shark-mug-coastal-breakfast","parentAttemptId":null,"tool":"OpenAI image generation","prompt":"Create a photorealistic vertical 2:3 Pinterest-native clean editorial photograph of a calm coastal breakfast built around the exact Glazery 13.5-ounce 3D shark ceramic mug in the attached reference. Preserve one ordinary usable mug with the exact product identity: glossy gray shark face wrapping the front, white back and loop handle, projecting pointed snout, one small fin on each side, tiny black dot eyes, narrow blue base rim, and a wide irregular red mouth opening edged with blunt white teeth. Fill the mug with dark coffee visible inside the red mouth without covering the teeth. Place it three-quarter front on a pale honed-limestone breakfast table, large enough to inspect, with one rumpled blue-and-white striped linen napkin, a small plate holding one slice of sourdough toast, and a simple stainless teaspoon. Use soft late-morning window light with restrained watery reflections on the wall, believable ceramic glaze and contact shadows, gentle 35mm editorial texture, slightly imperfect attainable styling, and generous breathing room. The visual joke must come only from the real shark-shaped mug in an elegant breakfast setting. Add no headline, caption, logo, price, badge, CTA, watermark, packaging, person, living animal, extra shark imagery, readable text, duplicate mug, extra fins, fantasy water, collage, UI, or ad-template composition. Keep the shark face, snout, fins, mouth, teeth, blue base, and handle fully consistent with the attached source image.","changesFromParent":"","referencePaths":["docs/ops/pinterest-creative-lab/v16-concepts/product-references/B0DFW4V57B-source.jpg"],"artifactPaths":["docs/ops/pinterest-creative-lab/v16-concepts/attempts/shark-mug-coastal-breakfast.png","docs/ops/pinterest-creative-lab/v16-concepts/01-shark-mug-coastal-breakfast.png"],"settings":{"resolution":"1024x1536","aspectRatio":"2:3","sourceAsin":"B0DFW4V57B","sourceSha256":"10df9a9c0cffbae6c81d8bc4f3948c0d84583f007feae6dcbdec51a7d66f2dcd","sha256":"ec02b61e6d5ef27d0e86f4342ed2ff8e8512869fdeb548c731b699e259705fdb"},"result":"generated","notes":["Generated from the exact current Amazon primary image and inspected at full useful resolution.","Selected as the final clean Arm A survivor; the retained root artifact is byte-identical to this attempt."]}}
