{"schemaVersion":1,"eventId":"evt-20260904-v10-toilet-golf-24h-learning","type":"learning.recorded","recordedAt":"2026-09-04T16:33:15-07:00","actor":"codex","data":{"experimentId":"exp-pinterest-static-format-v10","candidateId":"cand-v10-toilet-golf-country-club","scope":"candidate","statement":"The Toilet Golf Arm B Pin remains at zero public distribution and downstream activity at its first scheduled checkpoint after 24 hours.","evidenceEventIds":["evt-20260904-v10-toilet-golf-24h-metrics"],"decision":"Keep it measuring and preserve the seven-day cohort comparison gate; no headline-format conclusion is justified.","nextAction":"Recheck at seven days and compare Arm B only after the cohort has meaningful public impressions."}}
