{"schemaVersion":1,"eventId":"evt-20260905-v10-shark-mug-final-review","type":"review.recorded","recordedAt":"2026-09-05T23:38:14Z","actor":"codex","data":{"experimentId":"exp-pinterest-static-format-v10","candidateId":"cand-v10-shark-mug-coastal-breakfast","attemptId":"attempt-v10-shark-mug-coastal-breakfast","rubricVersion":1,"reviewer":"codex","scores":{"scrollStop":5,"pinterestNative":5,"aestheticQuality":5,"conceptClarity":5,"saveworthiness":4,"brandRestraint":5,"productFidelity":5,"aiArtifactControl":5},"gates":{"singleIdea":true,"truthfulProduct":true,"noEmbeddedCta":true,"noAdTemplate":true},"verdict":"advance","notes":["Full-resolution inspection shows one ordinary usable shark mug at plausible breakfast scale, preserving the source's gray face, white back and handle, tiny black eye, projecting pointed snout, small raised side fin, blue base rim, irregular red mouth opening, blunt white teeth, and glossy ceramic finish.","The pale limestone, restrained striped linen, toast, spoon, soft sun, and subtle watery reflections create a bright saveable coastal breakfast without inventing product capabilities or included accessories.","No headline, caption, logo, CTA, price, badge, frame, product card, package, duplicate, living shark, fantasy water, readable pseudo-writing, malformed food, floating object, or visible generation defect appears. No causal revision is justified."]}}
