{"schemaVersion":1,"eventId":"evt-20260902-v10-bullshit-button-shortlisted","type":"candidate.status_changed","recordedAt":"2026-09-02T16:39:00-07:00","actor":"codex","data":{"experimentId":"exp-pinterest-static-format-v10","candidateId":"cand-v10-bullshit-button-referee","from":"review","to":"shortlisted","rationale":"The meeting-headline execution passes every hard gate at a 4.50 mean with no dimension below 4, preserves the exact product identity and scale, and gives the new headline arm a clear workplace-specific click hypothesis without ad-template devices."}}
