{"schemaVersion":1,"eventId":"evt-20260903-v10-middle-management-created","type":"candidate.created","recordedAt":"2026-09-03T16:35:00-07:00","actor":"codex","data":{"experimentId":"exp-pinterest-static-format-v10","candidateId":"cand-v10-middle-management-statue","title":"The smiling middle-finger statue chairs a tiny boardroom","creativeFamily":"clean text-free editorial workplace scene built around the product's raised-finger head","audience":"Pinterest users saving funny coworker gifts, novelty desk decor, white elephant ideas, and quietly unhinged office humor","hook":"A polished miniature boardroom appears serious until the exact four-inch blue smiling middle-finger statue is seen presiding at the head of the table.","initialStatus":"idea","product":{"name":"Junwait blue smiling middle-finger synthetic-resin desk statue (ASIN B0C7J5SMPK)","sourceUrl":"https://www.amazon.com/dp/B0C7J5SMPK?tag=goose-gifts-37-20&linkCode=ogi&th=1&psc=1","destinationUrl":"https://www.goose.gifts/gifts/give-the-finger-office-edition"},"references":[{"source":"docs/ops/pinterest-creative-lab/v12-concepts/product-references/B0C7J5SMPK-source.jpg","lesson":"Preserve one small matte-blue round seated resin character with short blue arms, tiny flesh-tone hands and feet, and one tall flesh-tone middle finger that is also the long smiling face and head. Keep its front silhouette and roughly four-to-five-inch desk scale; do not add a separate raised arm or hand."}],"notes":["The 2026-09-03 afternoon slot is assigned Arm A, the clean text-free control, so morning and afternoon exposure alternate by local date.","Three product-derived concepts with stop reason, click reason, exact mechanism, swap test, fidelity risk, and anti-template mechanism are recorded in the v12 README.","The live Creators API listing is in stock at $12.99 and was touched by the latest completed weekly catalog run; the canonical destination is indexable and self-canonical."]}}
