{"schemaVersion":1,"eventId":"evt-20260903-v9-pizza-boss-24h-metrics","type":"metrics.recorded","recordedAt":"2026-09-03T16:34:00-07:00","actor":"codex","data":{"experimentId":"exp-pinterest-native-v9","candidateId":"cand-v9-pizza-boss-still-life","checkpointAt":"2026-09-03T23:33:59.905Z","cohort":"public","source":"Pinterest production API v5 public-pin metrics plus GA4 and first-party database acquisition checks","metrics":{"impressions":0,"saves":0,"pinClicks":0,"outboundClicks":0,"siteSessions":0,"affiliateClicks":0,"revenueCents":null},"caveats":["Captured about 30 hours 44 minutes after public Pin 1107815208387630624 was created; this is the first due checkpoint, not a 7-day verdict.","GA4 showed no Pinterest session and no product_click or affiliate_click row in the trailing seven days; the first-party database showed zero product clicks in the trailing seven days.","Pinterest v3 and Sandbox objects are excluded.","Revenue is unavailable from the current affiliate reporting path and remains null."]}}
