{
  "schemaVersion": 1,
  "eventId": "evt-20261023-pm-v11-metrics-1107815208388765155",
  "type": "metrics.recorded",
  "recordedAt": "2026-10-23T23:32:17.243Z",
  "actor": "codex",
  "data": {
    "experimentId": "exp-pinterest-editorial-mix-v11",
    "candidateId": "cand-v11-farting-ring-field-note",
    "checkpointAt": "2026-10-23T23:30:08.162Z",
    "cohort": "public",
    "source": "Scheduled measurement-only production Pinterest API lifetime snapshot; docs/ops/pinterest-measurements/2026-10-23-pm/measurement-20261023T233008162Z.json",
    "metrics": {
      "impressions": 25,
      "saves": 0,
      "pinClicks": 2,
      "outboundClicks": 0,
      "siteSessions": null,
      "affiliateClicks": null,
      "revenueCents": null
    },
    "caveats": [
      "Actual lifetime observation, not invented equal-age history; archived creative lifecycles retain public membership.",
      "GA4 property507421709 and PostHog550427 bounded QA/operator-excluded reads; per-Pin downstream remains unknown, not zero.",
      "Historical Goose links unchanged and not redirected; Stupid rebrand/destination intervention is not an unchanged acquisition test."
    ]
  }
}
