{"schemaVersion":1,"eventId":"evt-20260902-v9-pizza-boss-briefed","type":"candidate.status_changed","recordedAt":"2026-09-02T09:36:40-07:00","actor":"codex","data":{"experimentId":"exp-pinterest-native-v9","candidateId":"cand-v9-pizza-boss-still-life","from":"idea","to":"briefed","rationale":"The current listing, corrected price, indexable canonical destination, exact geometry, material, scale, three distinct concepts, click hypotheses, fidelity risks, and hard anti-template constraints are explicit."}}
