{"schemaVersion":1,"eventId":"evt-20260907-v10-mystic-pickle-midnight-review","type":"review.recorded","recordedAt":"2026-09-07T23:42:42Z","actor":"codex","data":{"experimentId":"exp-pinterest-static-format-v10","candidateId":"cand-v10-mystic-pickle-oracle","attemptId":"attempt-v10-mystic-pickle-midnight-oracle","rubricVersion":1,"reviewer":"codex","scores":{"scrollStop":4,"pinterestNative":5,"aestheticQuality":5,"conceptClarity":5,"saveworthiness":5,"brandRestraint":5,"productFidelity":4,"aiArtifactControl":5},"gates":{"singleIdea":true,"truthfulProduct":true,"noEmbeddedCta":true,"noAdTemplate":true},"verdict":"advance","notes":["Full-resolution inspection shows exactly one plausibly five-inch translucent yellow-green molded-plastic pickle toy, gentle curve, raised bumps, one circular inset window, and coherent contact on a small brass saucer.","The restrained crescent reflection, midnight-blue curtain, and plum velvet support the real fortune-teller purpose without adding a second divination object. The toy catches side light but does not appear to emit light.","No retail box, wizard art, readable text, person, hand, duplicate, invented window, face, food claim, CTA, badge, price, border, product card, watermark, or visible structural artifact appears.","The serious-versus-silly still life is a product-derived clean Arm A idea and passes every hard gate at 4.75/5."]}}
