{"schemaVersion":1,"eventId":"evt-20260906-v10-first-fire-aftermath-final-review","type":"review.recorded","recordedAt":"2026-09-06T23:45:41Z","actor":"codex","data":{"experimentId":"exp-pinterest-static-format-v10","candidateId":"cand-v10-first-fire-false-alarm","attemptId":"attempt-v10-first-fire-aftermath-headline","rubricVersion":1,"reviewer":"codex","scores":{"scrollStop":4,"pinterestNative":4,"aestheticQuality":4,"conceptClarity":5,"saveworthiness":4,"brandRestraint":5,"productFidelity":5,"aiArtifactControl":5},"gates":{"singleIdea":true,"truthfulProduct":true,"noEmbeddedCta":true,"noAdTemplate":true},"verdict":"reject","notes":["The quiet still life is warm, truthful, legible, and clean after the single composite correction; exactly one package appears at plausible scale, and its fixed text and artwork remain source-exact.","The exact six-word headline is tasteful and separate from the package, but the empty-room aftermath supplies less social tension and thumbnail energy than the party reveal.","Reject this passing alternative because the party execution gives a more immediate product-specific reason to pause; no further revision is justified."]}}
