{"schemaVersion":1,"eventId":"evt-20260831-goat-learned","type":"candidate.status_changed","recordedAt":"2026-08-31T10:11:00-07:00","actor":"codex","data":{"experimentId":"exp-pinterest-native-v4","candidateId":"cand-screaming-goat-meeting","from":"measuring","to":"learned","rationale":"The mature public checkpoint is recorded: 131 impressions, two Pin clicks, one save, and zero outbound clicks, attributable sessions, or affiliate clicks."}}
