{
  "schemaVersion": 1,
  "eventId": "evt-20260901-v7-butt-tape-24h-checkpoint",
  "type": "metrics.recorded",
  "recordedAt": "2026-09-01T09:48:23-07:00",
  "actor": "codex",
  "data": {
    "experimentId": "exp-pinterest-native-v7",
    "candidateId": "cand-v7-butt-tape-architecture",
    "checkpointAt": "2026-09-01T16:48:23.333Z",
    "cohort": "public",
    "source": "Pinterest production API v5 public-pin metrics, GA4 seven-day traffic/events/landing pages, and first-party acquisition database",
    "metrics": {"impressions": 0, "saves": 0, "pinClicks": 0, "outboundClicks": 0, "siteSessions": 0, "affiliateClicks": 0, "revenueCents": null},
    "caveats": ["Captured twelve seconds after the exact 24-hour age mark; Pinterest v3 and Sandbox are excluded.", "The zero is a distribution signal, not evidence against the creative itself; the Pin has not yet received an impression.", "GA4 reported 25 total seven-day sessions and no Pinterest source; the database recorded zero product-click events in 24 hours and zero in seven days."]
  }
}
