{"schemaVersion":1,"eventId":"evt-20260904-v10-wacky-tube-guy-review-status","type":"candidate.status_changed","recordedAt":"2026-09-04T16:36:25-07:00","actor":"codex","data":{"experimentId":"exp-pinterest-static-format-v10","candidateId":"cand-v10-wacky-tube-guy-hype","from":"generating","to":"review","rationale":"Both distinct 1024-by-1536 bases, the rejected first headline layout, and the single causal typography correction are saved and visually inspected at full useful resolution against the exact source, official scale/function, object count, material, and Arm B copy constraints."}}
